{
  "identity": {
    "currency": "CNY",
    "market": "CN",
    "name": "华辰装备",
    "security_status": "active",
    "symbol": "CN:300809",
    "ticker": "300809"
  },
  "reports": {
    "historical_artifacts": [
      {
        "format": "legacy_v1",
        "path": "reports/2026-07-15-initial.md",
        "sha256": "e53c87f2218abb2545baec92bc9ac6aad4646826f0656fea1ccd704415212fa9"
      }
    ],
    "history": [],
    "latest": null,
    "latest_by_type": {}
  },
  "research": {
    "coverage_status": "requires_rebaseline",
    "information_cutoff": null,
    "rebaseline_required": true
  },
  "schema_version": 2,
  "triggers": [
    {
      "active": true,
      "condition": {
        "date": "2026-08-31"
      },
      "reason": "复核2026年半年报，重点检查扣非利润、合同负债、新产品订单和金融资产扰动",
      "trigger_id": "legacy-review-1",
      "type": "date"
    },
    {
      "active": true,
      "condition": {
        "date": "2026-10-31"
      },
      "reason": "复核2026年三季报，确认收入确认节奏和全年主业利润趋势",
      "trigger_id": "legacy-review-2",
      "type": "date"
    },
    {
      "active": true,
      "condition": {
        "date": "2027-04-30"
      },
      "reason": "复核2026年年报，评估主业利润、新产品商业化和资本配置质量",
      "trigger_id": "legacy-review-3",
      "type": "date"
    },
    {
      "active": true,
      "condition": {
        "operator": "price_lte",
        "threshold": 15.5
      },
      "reason": "进入初始买入观察区，主业估值安全边际改善",
      "trigger_id": "legacy-price-1",
      "type": "price"
    },
    {
      "active": true,
      "condition": {
        "operator": "price_lte",
        "threshold": 12.0
      },
      "reason": "进入深度价值区，可重新评估是否具备显著安全边际",
      "trigger_id": "legacy-price-2",
      "type": "price"
    },
    {
      "active": true,
      "condition": {
        "operator": "price_gte",
        "threshold": 24.0
      },
      "reason": "超过基准公允价值上沿，若基本面未同步兑现应避免追高",
      "trigger_id": "legacy-price-3",
      "type": "price"
    },
    {
      "active": true,
      "condition": {
        "operator": "price_gte",
        "threshold": 30.0
      },
      "reason": "进入乐观情景估值上沿，需要减仓或重新核验增长兑现",
      "trigger_id": "legacy-price-4",
      "type": "price"
    }
  ],
  "underwriting": {
    "confidence": null,
    "evidence_valid_until": null,
    "reason_codes": [
      "legacy_reports_require_structured_rebaseline"
    ],
    "review_id": null,
    "status": null
  },
  "updated_at": "2026-07-21T21:15:00+08:00",
  "valuation": {
    "bear_value": null,
    "buy_zone": null,
    "currency": null,
    "fair_value_range": null,
    "price_as_of": null,
    "reduce_zone": null
  }
}
