{
  "identity": {
    "currency": "CNY",
    "market": "CN",
    "name": "豪江智能",
    "security_status": "active",
    "symbol": "CN:301320",
    "ticker": "301320"
  },
  "reports": {
    "historical_artifacts": [
      {
        "format": "legacy_v1",
        "path": "reports/2026-07-16-initial.md",
        "sha256": "49659f99108ea8b19ca0ffd58883608c95ca5e0682f9bb879fddf7165d543a88"
      }
    ],
    "history": [],
    "latest": null,
    "latest_by_type": {}
  },
  "research": {
    "coverage_status": "requires_rebaseline",
    "information_cutoff": null,
    "rebaseline_required": true
  },
  "schema_version": 2,
  "triggers": [
    {
      "active": true,
      "condition": {
        "date": "2026-08-31"
      },
      "reason": "复核 2026 半年报，重点检查收入增速、毛利率、管理费用率、扣非净利率和经营现金流。",
      "trigger_id": "legacy-review-1",
      "type": "date"
    },
    {
      "active": true,
      "condition": {
        "date": "2026-10-31"
      },
      "reason": "复核 2026 三季报，确认利润修复是否具备连续性。",
      "trigger_id": "legacy-review-2",
      "type": "date"
    },
    {
      "active": true,
      "condition": {
        "date": "2027-04-30"
      },
      "reason": "复核 2026 年报，重估泰国基地、电子类产品和康养应用的长期盈利能力。",
      "trigger_id": "legacy-review-3",
      "type": "date"
    },
    {
      "active": true,
      "condition": {
        "operator": "price_lte",
        "threshold": 9.5
      },
      "reason": "进入初步买区，需要复核利润率和现金流是否同步改善。",
      "trigger_id": "legacy-price-1",
      "type": "price"
    },
    {
      "active": true,
      "condition": {
        "operator": "price_gte",
        "threshold": 17.0
      },
      "reason": "股价基本反映乐观情景，若利润修复未兑现应减仓或回避。",
      "trigger_id": "legacy-price-2",
      "type": "price"
    }
  ],
  "underwriting": {
    "confidence": null,
    "evidence_valid_until": null,
    "reason_codes": [
      "legacy_reports_require_structured_rebaseline"
    ],
    "review_id": null,
    "status": null
  },
  "updated_at": "2026-07-21T21:15:00+08:00",
  "valuation": {
    "bear_value": null,
    "buy_zone": null,
    "currency": null,
    "fair_value_range": null,
    "price_as_of": null,
    "reduce_zone": null
  }
}
