{
  "identity": {
    "currency": "CNY",
    "market": "CN",
    "name": "英华特",
    "security_status": "active",
    "symbol": "CN:301272",
    "ticker": "301272"
  },
  "reports": {
    "historical_artifacts": [
      {
        "format": "legacy_v1",
        "path": "reports/2026-07-16-initial.md",
        "sha256": "3ab6078e4400dfe585ef3a7a8187d01ccbd657a449a06413dd1d11477c9d669d"
      }
    ],
    "history": [],
    "latest": null,
    "latest_by_type": {}
  },
  "research": {
    "coverage_status": "requires_rebaseline",
    "information_cutoff": null,
    "rebaseline_required": true
  },
  "schema_version": 2,
  "triggers": [
    {
      "active": true,
      "condition": {
        "date": "2026-08-31"
      },
      "reason": "复核2026年半年报：收入、毛利率、利润、经营现金流、海外收入和离心压缩机进展。",
      "trigger_id": "legacy-review-1",
      "type": "date"
    },
    {
      "active": true,
      "condition": {
        "date": "2026-10-31"
      },
      "reason": "复核2026年三季报：验证Q1亏损后是否持续修复。",
      "trigger_id": "legacy-review-2",
      "type": "date"
    },
    {
      "active": true,
      "condition": {
        "date": "2027-04-30"
      },
      "reason": "复核2026年年报：判断研发投入、离心子公司和主业盈利是否形成闭环。",
      "trigger_id": "legacy-review-3",
      "type": "date"
    },
    {
      "active": true,
      "condition": {
        "operator": "price_lte",
        "threshold": 28.0
      },
      "reason": "进入初步安全边际区间，复核2026H1盈利和现金流后可考虑小仓位。",
      "trigger_id": "legacy-price-1",
      "type": "price"
    },
    {
      "active": true,
      "condition": {
        "operator": "price_lte",
        "threshold": 24.0
      },
      "reason": "低于估算买区下沿，若基本面未恶化且减持压力释放，可重新评估加仓。",
      "trigger_id": "legacy-price-2",
      "type": "price"
    },
    {
      "active": true,
      "condition": {
        "operator": "price_gte",
        "threshold": 44.0
      },
      "reason": "超过基准估值上沿，若利润和离心订单未兑现，应减仓或回避。",
      "trigger_id": "legacy-price-3",
      "type": "price"
    }
  ],
  "underwriting": {
    "confidence": null,
    "evidence_valid_until": null,
    "reason_codes": [
      "legacy_reports_require_structured_rebaseline"
    ],
    "review_id": null,
    "status": null
  },
  "updated_at": "2026-07-21T21:15:00+08:00",
  "valuation": {
    "bear_value": null,
    "buy_zone": null,
    "currency": null,
    "fair_value_range": null,
    "price_as_of": null,
    "reduce_zone": null
  }
}
