{
  "identity": {
    "currency": "CNY",
    "market": "CN",
    "name": "唯捷创芯",
    "security_status": "active",
    "symbol": "CN:688153",
    "ticker": "688153"
  },
  "reports": {
    "historical_artifacts": [
      {
        "format": "legacy_v1",
        "path": "reports/2026-07-18-initial.md",
        "sha256": "2b4243c29b5c13aa9f75867b7f7f894ff87d77840562eddb32feeb5e23324180"
      }
    ],
    "history": [],
    "latest": null,
    "latest_by_type": {}
  },
  "research": {
    "coverage_status": "requires_rebaseline",
    "information_cutoff": null,
    "rebaseline_required": true
  },
  "schema_version": 2,
  "triggers": [
    {
      "active": true,
      "condition": {
        "date": "2026-08-31"
      },
      "reason": "复核2026年中报收入、毛利率、研发费用率、存货与现金流。",
      "trigger_id": "legacy-review-1",
      "type": "date"
    },
    {
      "active": true,
      "condition": {
        "date": "2026-10-31"
      },
      "reason": "复核2026年三季报及H2旺季备货兑现情况。",
      "trigger_id": "legacy-review-2",
      "type": "date"
    },
    {
      "active": true,
      "condition": {
        "date": "2027-04-30"
      },
      "reason": "复核2026年年报，确认高集成模组、新产品线和外延投资是否兑现。",
      "trigger_id": "legacy-review-3",
      "type": "date"
    },
    {
      "active": true,
      "condition": {
        "operator": "price_lte",
        "threshold": 24.0
      },
      "reason": "进入深度安全边际区，若基本面未恶化可复核增配。",
      "trigger_id": "legacy-price-1",
      "type": "price"
    },
    {
      "active": true,
      "condition": {
        "operator": "price_gte",
        "threshold": 45.0
      },
      "reason": "高于合理价值区间上沿，需要利润率显著兑现，否则应减持。",
      "trigger_id": "legacy-price-2",
      "type": "price"
    }
  ],
  "underwriting": {
    "confidence": null,
    "evidence_valid_until": null,
    "reason_codes": [
      "legacy_reports_require_structured_rebaseline"
    ],
    "review_id": null,
    "status": null
  },
  "updated_at": "2026-07-21T21:15:00+08:00",
  "valuation": {
    "bear_value": null,
    "buy_zone": null,
    "currency": null,
    "fair_value_range": null,
    "price_as_of": null,
    "reduce_zone": null
  }
}
