{
  "identity": {
    "currency": "CNY",
    "market": "CN",
    "name": "必贝特",
    "security_status": "active",
    "symbol": "CN:688759",
    "ticker": "688759"
  },
  "reports": {
    "historical_artifacts": [
      {
        "format": "legacy_v1",
        "path": "reports/2026-07-18-initial.md",
        "sha256": "bc178c0fc12dfa1b11b5729ee91882a3b840d0750027a8f65497ae969bb9fbd8"
      }
    ],
    "history": [],
    "latest": null,
    "latest_by_type": {}
  },
  "research": {
    "coverage_status": "requires_rebaseline",
    "information_cutoff": null,
    "rebaseline_required": true
  },
  "schema_version": 2,
  "triggers": [
    {
      "active": true,
      "condition": {
        "date": "2026-08-31"
      },
      "reason": "复核2026年中报中贝特琳销售收入、费用率和现金消耗",
      "trigger_id": "legacy-review-1",
      "type": "date"
    },
    {
      "active": true,
      "condition": {
        "date": "2026-11-15"
      },
      "reason": "复核三季报、医保谈判进展及上市后准入速度",
      "trigger_id": "legacy-review-2",
      "type": "date"
    },
    {
      "active": true,
      "condition": {
        "date": "2027-03-31"
      },
      "reason": "复核2026年年报、商业化全年表现和后续管线进展",
      "trigger_id": "legacy-review-3",
      "type": "date"
    },
    {
      "active": true,
      "condition": {
        "operator": "price_lte",
        "threshold": 24.0
      },
      "reason": "进入基准估值下沿，可复核商业化与医保进展后考虑观察仓",
      "trigger_id": "legacy-price-1",
      "type": "price"
    },
    {
      "active": true,
      "condition": {
        "operator": "price_lte",
        "threshold": 18.0
      },
      "reason": "进入悲观情景估值区，若基本面未恶化则安全边际改善",
      "trigger_id": "legacy-price-2",
      "type": "price"
    },
    {
      "active": true,
      "condition": {
        "operator": "price_gte",
        "threshold": 42.0
      },
      "reason": "接近乐观情景估值下沿，若缺少收入或临床超预期应降低仓位",
      "trigger_id": "legacy-price-3",
      "type": "price"
    }
  ],
  "underwriting": {
    "confidence": null,
    "evidence_valid_until": null,
    "reason_codes": [
      "legacy_reports_require_structured_rebaseline"
    ],
    "review_id": null,
    "status": null
  },
  "updated_at": "2026-07-21T21:15:00+08:00",
  "valuation": {
    "bear_value": null,
    "buy_zone": null,
    "currency": null,
    "fair_value_range": null,
    "price_as_of": null,
    "reduce_zone": null
  }
}
