{
  "identity": {
    "currency": "CNY",
    "market": "CN",
    "name": "新瀚新材",
    "security_status": "active",
    "symbol": "CN:301076",
    "ticker": "301076"
  },
  "reports": {
    "historical_artifacts": [
      {
        "format": "legacy_v1",
        "path": "reports/2026-07-16-initial.md",
        "sha256": "0b9e5c714a58289ed692d26d9fc77642fd8b13aa40603f364565e2d07b5fc326"
      }
    ],
    "history": [],
    "latest": null,
    "latest_by_type": {}
  },
  "research": {
    "coverage_status": "requires_rebaseline",
    "information_cutoff": null,
    "rebaseline_required": true
  },
  "schema_version": 2,
  "triggers": [
    {
      "active": true,
      "condition": {
        "date": "2026-08-31"
      },
      "reason": "复核 2026 年半年报，重点看三车间爬坡、DFBP 毛利率和经营现金流",
      "trigger_id": "legacy-review-1",
      "type": "date"
    },
    {
      "active": true,
      "condition": {
        "date": "2026-10-31"
      },
      "reason": "复核 2026 年三季报，确认新增产能是否带来利润台阶",
      "trigger_id": "legacy-review-2",
      "type": "date"
    },
    {
      "active": true,
      "condition": {
        "date": "2027-03-31"
      },
      "reason": "复核 2026 年报和 PAEK 项目进展，重新估值",
      "trigger_id": "legacy-review-3",
      "type": "date"
    },
    {
      "active": true,
      "condition": {
        "operator": "price_lte",
        "threshold": 13.5
      },
      "reason": "进入保守买入区，重新评估基本面后可考虑小仓位建仓",
      "trigger_id": "legacy-price-1",
      "type": "price"
    },
    {
      "active": true,
      "condition": {
        "operator": "price_gte",
        "threshold": 24.0
      },
      "reason": "超过基准价值区间较多，若无订单和利润兑现应减持或观望",
      "trigger_id": "legacy-price-2",
      "type": "price"
    }
  ],
  "underwriting": {
    "confidence": null,
    "evidence_valid_until": null,
    "reason_codes": [
      "legacy_reports_require_structured_rebaseline"
    ],
    "review_id": null,
    "status": null
  },
  "updated_at": "2026-07-21T21:15:00+08:00",
  "valuation": {
    "bear_value": null,
    "buy_zone": null,
    "currency": null,
    "fair_value_range": null,
    "price_as_of": null,
    "reduce_zone": null
  }
}
