{
  "identity": {
    "currency": "CNY",
    "market": "CN",
    "name": "泸天化",
    "security_status": "active",
    "symbol": "CN:000912",
    "ticker": "000912"
  },
  "reports": {
    "historical_artifacts": [
      {
        "format": "legacy_v1",
        "path": "reports/2026-07-11-initial.md",
        "sha256": "4e5712e2ca7c29311e4f32a374b6ffe0546f57c043819e257f3523dd8ffa8d46"
      }
    ],
    "history": [],
    "latest": null,
    "latest_by_type": {}
  },
  "research": {
    "coverage_status": "requires_rebaseline",
    "information_cutoff": null,
    "rebaseline_required": true
  },
  "schema_version": 2,
  "triggers": [
    {
      "active": true,
      "condition": {
        "date": "2026-08-31"
      },
      "reason": "复核2026年半年度报告、扣非利润、现金流和装置开工",
      "trigger_id": "legacy-review-1",
      "type": "date"
    },
    {
      "active": true,
      "condition": {
        "date": "2026-10-31"
      },
      "reason": "复核2026年三季度报告和秋季肥需求",
      "trigger_id": "legacy-review-2",
      "type": "date"
    },
    {
      "active": true,
      "condition": {
        "operator": "price_lte",
        "threshold": 3.3
      },
      "reason": "进入初始买入观察区间",
      "trigger_id": "legacy-price-1",
      "type": "price"
    },
    {
      "active": true,
      "condition": {
        "operator": "price_lte",
        "threshold": 2.7
      },
      "reason": "进入深度价值复核区间，需要重新核验现金流和资产质量",
      "trigger_id": "legacy-price-2",
      "type": "price"
    },
    {
      "active": true,
      "condition": {
        "operator": "price_gte",
        "threshold": 4.4
      },
      "reason": "进入减仓复核区间，需确认利润修复是否已被报表验证",
      "trigger_id": "legacy-price-3",
      "type": "price"
    }
  ],
  "underwriting": {
    "confidence": null,
    "evidence_valid_until": null,
    "reason_codes": [
      "legacy_reports_require_structured_rebaseline"
    ],
    "review_id": null,
    "status": null
  },
  "updated_at": "2026-07-21T21:15:00+08:00",
  "valuation": {
    "bear_value": null,
    "buy_zone": null,
    "currency": null,
    "fair_value_range": null,
    "price_as_of": null,
    "reduce_zone": null
  }
}
