{
  "identity": {
    "currency": "CNY",
    "market": "CN",
    "name": "*ST开元",
    "security_status": "active",
    "symbol": "CN:300338",
    "ticker": "300338"
  },
  "reports": {
    "historical_artifacts": [
      {
        "format": "legacy_v1",
        "path": "reports/2026-07-20-initial.md",
        "sha256": "dc147bd2b58b4c07a7680081cef36dbfeddee12d89d24bd5acecdb2ad25aebb9"
      }
    ],
    "history": [],
    "latest": null,
    "latest_by_type": {}
  },
  "research": {
    "coverage_status": "requires_rebaseline",
    "information_cutoff": null,
    "rebaseline_required": true
  },
  "schema_version": 2,
  "triggers": [
    {
      "active": true,
      "condition": {
        "date": "2026-08-31"
      },
      "reason": "复核2026半年报：净资产、经营现金流、收入是否维持上市安全线",
      "trigger_id": "legacy-review-1",
      "type": "date"
    },
    {
      "active": true,
      "condition": {
        "date": "2026-10-31"
      },
      "reason": "复核2026三季报和重整进展，判断年报退市触发概率",
      "trigger_id": "legacy-review-2",
      "type": "date"
    },
    {
      "active": true,
      "condition": {
        "date": "2027-04-30"
      },
      "reason": "复核2026年报、审计意见和是否满足撤销退市风险警示条件",
      "trigger_id": "legacy-review-3",
      "type": "date"
    },
    {
      "active": true,
      "condition": {
        "operator": "price_lte",
        "threshold": 0.8
      },
      "reason": "进入安全边际观察区，但仍需同时确认退市风险未恶化",
      "trigger_id": "legacy-price-1",
      "type": "price"
    },
    {
      "active": true,
      "condition": {
        "operator": "price_lte",
        "threshold": 0.4
      },
      "reason": "进入强吸引力困境期权区，可结合重整进展复核是否试探",
      "trigger_id": "legacy-price-2",
      "type": "price"
    },
    {
      "active": true,
      "condition": {
        "operator": "price_gte",
        "threshold": 1.5
      },
      "reason": "超过合理区间上沿，重整乐观预期定价过满，应回避或减仓",
      "trigger_id": "legacy-price-3",
      "type": "price"
    }
  ],
  "underwriting": {
    "confidence": null,
    "evidence_valid_until": null,
    "reason_codes": [
      "legacy_reports_require_structured_rebaseline"
    ],
    "review_id": null,
    "status": null
  },
  "updated_at": "2026-07-21T21:15:00+08:00",
  "valuation": {
    "bear_value": null,
    "buy_zone": null,
    "currency": null,
    "fair_value_range": null,
    "price_as_of": null,
    "reduce_zone": null
  }
}
