{
  "identity": {
    "currency": "CNY",
    "market": "CN",
    "name": "百隆东方",
    "security_status": "active",
    "symbol": "CN:601339",
    "ticker": "601339"
  },
  "reports": {
    "historical_artifacts": [
      {
        "format": "legacy_v1",
        "path": "reports/2026-07-17-initial.md",
        "sha256": "020afa734fa6f5f14ac752dd4dc13c29024d8b8adb50ad9cb6c4c9d338b2193d"
      }
    ],
    "history": [],
    "latest": null,
    "latest_by_type": {}
  },
  "research": {
    "coverage_status": "requires_rebaseline",
    "information_cutoff": null,
    "rebaseline_required": true
  },
  "schema_version": 2,
  "triggers": [
    {
      "active": true,
      "condition": {
        "date": "2026-08-31"
      },
      "reason": "复核 2026 年半年报实际利润、现金流、色纺纱毛利率和库存变化",
      "trigger_id": "legacy-review-1",
      "type": "date"
    },
    {
      "active": true,
      "condition": {
        "date": "2026-10-31"
      },
      "reason": "复核 2026 年三季报，判断 H1 高景气是否延续到 H2",
      "trigger_id": "legacy-review-2",
      "type": "date"
    },
    {
      "active": true,
      "condition": {
        "date": "2027-04-30"
      },
      "reason": "复核 2026 年报、分红和越南百隆盈利持续性",
      "trigger_id": "legacy-review-3",
      "type": "date"
    },
    {
      "active": true,
      "condition": {
        "operator": "price_lte",
        "threshold": 7.2
      },
      "reason": "进入买入区间上沿，若半年报兑现则安全边际改善",
      "trigger_id": "legacy-price-1",
      "type": "price"
    },
    {
      "active": true,
      "condition": {
        "operator": "price_lte",
        "threshold": 6.5
      },
      "reason": "接近悲观情景上沿，分红和资产负债表提供更好保护",
      "trigger_id": "legacy-price-2",
      "type": "price"
    },
    {
      "active": true,
      "condition": {
        "operator": "price_gte",
        "threshold": 10.8
      },
      "reason": "超过合理价值区间，需要 2026 全年高景气利润支撑，否则应减仓",
      "trigger_id": "legacy-price-3",
      "type": "price"
    },
    {
      "active": true,
      "condition": {
        "operator": "price_gte",
        "threshold": 12.0
      },
      "reason": "接近乐观情景上沿，周期制造资产安全边际不足",
      "trigger_id": "legacy-price-4",
      "type": "price"
    }
  ],
  "underwriting": {
    "confidence": null,
    "evidence_valid_until": null,
    "reason_codes": [
      "legacy_reports_require_structured_rebaseline"
    ],
    "review_id": null,
    "status": null
  },
  "updated_at": "2026-07-21T21:15:00+08:00",
  "valuation": {
    "bear_value": null,
    "buy_zone": null,
    "currency": null,
    "fair_value_range": null,
    "price_as_of": null,
    "reduce_zone": null
  }
}
