{
  "identity": {
    "currency": "CNY",
    "market": "CN",
    "name": "恒尚节能",
    "security_status": "active",
    "symbol": "CN:603137",
    "ticker": "603137"
  },
  "reports": {
    "historical_artifacts": [
      {
        "format": "legacy_v1",
        "path": "reports/2026-07-17-initial.md",
        "sha256": "c576966827ef6fb31cbd5573d799a23655c5a2bf744b1c4d4790c390adeb73ea"
      }
    ],
    "history": [],
    "latest": null,
    "latest_by_type": {}
  },
  "research": {
    "coverage_status": "requires_rebaseline",
    "information_cutoff": null,
    "rebaseline_required": true
  },
  "schema_version": 2,
  "triggers": [
    {
      "active": true,
      "condition": {
        "date": "2026-08-31"
      },
      "reason": "复核2026年半年报，重点看收入降幅、经营现金流、应收账款和合同资产",
      "trigger_id": "legacy-review-1",
      "type": "date"
    },
    {
      "active": true,
      "condition": {
        "date": "2026-10-31"
      },
      "reason": "复核2026年三季报和重组进展，确认并购是否继续推进及主业是否企稳",
      "trigger_id": "legacy-review-2",
      "type": "date"
    },
    {
      "active": true,
      "condition": {
        "date": "2027-04-30"
      },
      "reason": "复核2026年年报、审计意见、减值和重组结果",
      "trigger_id": "legacy-review-3",
      "type": "date"
    },
    {
      "active": true,
      "condition": {
        "operator": "price_lte",
        "threshold": 9.5
      },
      "reason": "跌入买入观察区，需要复核主业现金流、订单和重组条款是否改善",
      "trigger_id": "legacy-price-1",
      "type": "price"
    },
    {
      "active": true,
      "condition": {
        "operator": "price_gte",
        "threshold": 20.0
      },
      "reason": "显著高于乐观情景价值上沿，若无经审计高质量并购利润和主业修复，应回避或减持",
      "trigger_id": "legacy-price-2",
      "type": "price"
    }
  ],
  "underwriting": {
    "confidence": null,
    "evidence_valid_until": null,
    "reason_codes": [
      "legacy_reports_require_structured_rebaseline"
    ],
    "review_id": null,
    "status": null
  },
  "updated_at": "2026-07-21T21:15:00+08:00",
  "valuation": {
    "bear_value": null,
    "buy_zone": null,
    "currency": null,
    "fair_value_range": null,
    "price_as_of": null,
    "reduce_zone": null
  }
}
