{
  "identity": {
    "currency": "CNY",
    "market": "CN",
    "name": "卓越新能",
    "security_status": "active",
    "symbol": "CN:688196",
    "ticker": "688196"
  },
  "reports": {
    "historical_artifacts": [
      {
        "format": "legacy_v1",
        "path": "reports/2026-07-18-initial.md",
        "sha256": "5dd4e0f3aa44a270005af6aa1deca7777c2d6bfe814a9659560602bf6e2b668f"
      }
    ],
    "history": [],
    "latest": null,
    "latest_by_type": {}
  },
  "research": {
    "coverage_status": "requires_rebaseline",
    "information_cutoff": null,
    "rebaseline_required": true
  },
  "schema_version": 2,
  "triggers": [
    {
      "active": true,
      "condition": {
        "date": "2026-08-27"
      },
      "reason": "预计2026年半年报披露后复核毛利率、存货、经营现金流和补税影响。",
      "trigger_id": "legacy-review-1",
      "type": "date"
    },
    {
      "active": true,
      "condition": {
        "date": "2026-10-31"
      },
      "reason": "2026年三季报后复核HVO/SAF试生产、海外项目进度和全年盈利中枢。",
      "trigger_id": "legacy-review-2",
      "type": "date"
    },
    {
      "active": true,
      "condition": {
        "operator": "price_lte",
        "threshold": 28.0
      },
      "reason": "进入明显安全边际区，若基本面未恶化可复核加仓。",
      "trigger_id": "legacy-price-1",
      "type": "price"
    },
    {
      "active": true,
      "condition": {
        "operator": "price_gte",
        "threshold": 50.0
      },
      "reason": "超过当前合理价值区间上沿，需要复核HVO/SAF兑现程度并考虑减仓。",
      "trigger_id": "legacy-price-2",
      "type": "price"
    }
  ],
  "underwriting": {
    "confidence": null,
    "evidence_valid_until": null,
    "reason_codes": [
      "legacy_reports_require_structured_rebaseline"
    ],
    "review_id": null,
    "status": null
  },
  "updated_at": "2026-07-21T21:15:00+08:00",
  "valuation": {
    "bear_value": null,
    "buy_zone": null,
    "currency": null,
    "fair_value_range": null,
    "price_as_of": null,
    "reduce_zone": null
  }
}
