{
  "identity": {
    "currency": "CNY",
    "market": "CN",
    "name": "富乐德",
    "security_status": "active",
    "symbol": "CN:301297",
    "ticker": "301297"
  },
  "reports": {
    "historical_artifacts": [
      {
        "format": "legacy_v1",
        "path": "reports/2026-07-10-initial.md",
        "sha256": "93f4dc0323651d97817fc9ff4451408b0db8cdab6be4af00fd347426404324ec"
      }
    ],
    "history": [],
    "latest": null,
    "latest_by_type": {}
  },
  "research": {
    "coverage_status": "requires_rebaseline",
    "information_cutoff": null,
    "rebaseline_required": true
  },
  "schema_version": 2,
  "triggers": [
    {
      "active": true,
      "condition": {
        "date": "2026-08-31"
      },
      "reason": "复查2026年中报，重点确认洗净收入、材料毛利率、应收存货和经营现金流",
      "trigger_id": "legacy-review-1",
      "type": "date"
    },
    {
      "active": true,
      "condition": {
        "date": "2026-10-31"
      },
      "reason": "复查2026年三季报，验证富乐华并表后利润趋势和资产质量",
      "trigger_id": "legacy-review-2",
      "type": "date"
    },
    {
      "active": true,
      "condition": {
        "operator": "price_lte",
        "threshold": 32.0
      },
      "reason": "进入初始买入区间，需要复核中报和现金流后决定首笔仓位",
      "trigger_id": "legacy-price-1",
      "type": "price"
    },
    {
      "active": true,
      "condition": {
        "operator": "price_lte",
        "threshold": 28.0
      },
      "reason": "进入较高安全边际区间，若基本面未恶化可加大仓位",
      "trigger_id": "legacy-price-2",
      "type": "price"
    },
    {
      "active": true,
      "condition": {
        "operator": "price_gte",
        "threshold": 48.0
      },
      "reason": "进入减仓或不追高区间，当前价格已贴近乐观情景",
      "trigger_id": "legacy-price-3",
      "type": "price"
    },
    {
      "active": true,
      "condition": {
        "operator": "price_gte",
        "threshold": 60.0
      },
      "reason": "显著高于合理价值，需要除非业绩连续超预期否则卖出或回避",
      "trigger_id": "legacy-price-4",
      "type": "price"
    }
  ],
  "underwriting": {
    "confidence": null,
    "evidence_valid_until": null,
    "reason_codes": [
      "legacy_reports_require_structured_rebaseline"
    ],
    "review_id": null,
    "status": null
  },
  "updated_at": "2026-07-21T21:15:00+08:00",
  "valuation": {
    "bear_value": null,
    "buy_zone": null,
    "currency": null,
    "fair_value_range": null,
    "price_as_of": null,
    "reduce_zone": null
  }
}
