{
  "identity": {
    "currency": "CNY",
    "market": "CN",
    "name": "安道麦A",
    "security_status": "active",
    "symbol": "CN:000553",
    "ticker": "000553"
  },
  "reports": {
    "historical_artifacts": [
      {
        "format": "legacy_v1",
        "path": "reports/2026-07-10-initial.md",
        "sha256": "15e8812bfa28a3295e6575a3a89775ee4709760f83baf65f8a12864c6bae773f"
      }
    ],
    "history": [],
    "latest": null,
    "latest_by_type": {}
  },
  "research": {
    "coverage_status": "covered",
    "information_cutoff": "2026-07-29T09:37:20+08:00",
    "rebaseline_required": false
  },
  "schema_version": 2,
  "triggers": [
    {
      "active": true,
      "condition": {
        "date": "2026-08-31"
      },
      "reason": "复查2026年中报的毛利率、扣非净利润、经营现金流、存货和债务",
      "trigger_id": "legacy-review-1",
      "type": "date"
    },
    {
      "active": true,
      "condition": {
        "date": "2026-10-31"
      },
      "reason": "复查2026年三季报和全球农化补库、原药价格趋势",
      "trigger_id": "legacy-review-2",
      "type": "date"
    },
    {
      "active": true,
      "condition": {
        "operator": "price_lte",
        "threshold": 5.3
      },
      "reason": "进入首笔买入区间，复核中报和行业价格后决定是否建仓",
      "trigger_id": "legacy-price-1",
      "type": "price"
    },
    {
      "active": true,
      "condition": {
        "operator": "price_lte",
        "threshold": 4.8
      },
      "reason": "进入更高安全边际区间，若基本面未恶化可考虑加仓",
      "trigger_id": "legacy-price-2",
      "type": "price"
    },
    {
      "active": true,
      "condition": {
        "operator": "price_gte",
        "threshold": 7.2
      },
      "reason": "达到基准合理价值上沿，若盈利未确认需减仓",
      "trigger_id": "legacy-price-3",
      "type": "price"
    }
  ],
  "underwriting": {
    "confidence": null,
    "evidence_valid_until": null,
    "reason_codes": [
      "legacy_reports_require_structured_rebaseline"
    ],
    "review_id": null,
    "status": null
  },
  "updated_at": "2026-07-31T15:37:38.372218+08:00",
  "valuation": {
    "bear_value": null,
    "buy_zone": null,
    "currency": null,
    "fair_value_range": null,
    "price_as_of": null,
    "reduce_zone": null
  }
}
