{
  "identity": {
    "currency": "CNY",
    "market": "CN",
    "name": "中国联通",
    "security_status": "active",
    "symbol": "CN:600050",
    "ticker": "600050"
  },
  "reports": {
    "historical_artifacts": [
      {
        "format": "legacy_v1",
        "path": "reports/2026-07-08-initial.md",
        "sha256": "b94be48a232e54251fc718a9a77170ffcaa77845b2c1b955a5d5614cf5688319"
      },
      {
        "format": "legacy_v1",
        "path": "reports/2026-07-16-initial.md",
        "sha256": "a32b15f0a071d81e8c96e45a300603a9c5606851c3ce85409ad0dbb86004974a"
      }
    ],
    "history": [],
    "latest": null,
    "latest_by_type": {}
  },
  "research": {
    "coverage_status": "requires_rebaseline",
    "information_cutoff": null,
    "rebaseline_required": true
  },
  "schema_version": 2,
  "triggers": [
    {
      "active": true,
      "condition": {
        "date": "2026-08-31"
      },
      "reason": "复核2026年中报，重点确认Q1利润下滑是否修复、算力业务增速和自由现金流",
      "trigger_id": "legacy-review-1",
      "type": "date"
    },
    {
      "active": true,
      "condition": {
        "date": "2026-10-31"
      },
      "reason": "复核2026年三季报，检查收入、利润、资本开支和派息预期是否支持估值上调",
      "trigger_id": "legacy-review-2",
      "type": "date"
    },
    {
      "active": true,
      "condition": {
        "date": "2027-03-31"
      },
      "reason": "复核2026年报和年度分红方案，确认央企红利逻辑是否延续",
      "trigger_id": "legacy-review-3",
      "type": "date"
    },
    {
      "active": true,
      "condition": {
        "operator": "price_lte",
        "threshold": 4.2
      },
      "reason": "接近0.77倍PB、股息率约4%附近，安全边际开始出现",
      "trigger_id": "legacy-price-1",
      "type": "price"
    },
    {
      "active": true,
      "condition": {
        "operator": "price_lte",
        "threshold": 3.8
      },
      "reason": "进入悲观情景估值区间，若基本面未恶化则风险收益比明显改善",
      "trigger_id": "legacy-price-2",
      "type": "price"
    },
    {
      "active": true,
      "condition": {
        "operator": "price_gte",
        "threshold": 5.6
      },
      "reason": "超过基准情景上沿，除非利润修复或派息率上调，否则预期收益不足",
      "trigger_id": "legacy-price-3",
      "type": "price"
    },
    {
      "active": true,
      "condition": {
        "operator": "price_gte",
        "threshold": 6.4
      },
      "reason": "接近乐观情景估值上沿，分红收益率下降且A/H溢价风险扩大",
      "trigger_id": "legacy-price-4",
      "type": "price"
    }
  ],
  "underwriting": {
    "confidence": null,
    "evidence_valid_until": null,
    "reason_codes": [
      "legacy_reports_require_structured_rebaseline"
    ],
    "review_id": null,
    "status": null
  },
  "updated_at": "2026-07-21T21:15:00+08:00",
  "valuation": {
    "bear_value": null,
    "buy_zone": null,
    "currency": null,
    "fair_value_range": null,
    "price_as_of": null,
    "reduce_zone": null
  }
}
