{
  "identity": {
    "currency": "CNY",
    "market": "CN",
    "name": "西藏旅游",
    "security_status": "active",
    "symbol": "CN:600749",
    "ticker": "600749"
  },
  "reports": {
    "historical_artifacts": [
      {
        "format": "legacy_v1",
        "path": "reports/2026-07-17-initial.md",
        "sha256": "bb768708be8f53333736ff51f8abc7e01bd96fcaae3eded13cfcb2b2f4cd5545"
      }
    ],
    "history": [],
    "latest": null,
    "latest_by_type": {}
  },
  "research": {
    "coverage_status": "requires_rebaseline",
    "information_cutoff": null,
    "rebaseline_required": true
  },
  "schema_version": 2,
  "triggers": [
    {
      "active": true,
      "condition": {
        "date": "2026-08-31"
      },
      "reason": "复核2026年半年报，重点检查阿里片区、林芝片区、香客接待投资收益和经营现金流",
      "trigger_id": "legacy-review-1",
      "type": "date"
    },
    {
      "active": true,
      "condition": {
        "date": "2026-10-31"
      },
      "reason": "复核2026年三季报和旺季经营质量，判断利润持续性",
      "trigger_id": "legacy-review-2",
      "type": "date"
    },
    {
      "active": true,
      "condition": {
        "date": "2027-04-30"
      },
      "reason": "复核2026年年报，更新估值、买入区间和仓位上限",
      "trigger_id": "legacy-review-3",
      "type": "date"
    },
    {
      "active": true,
      "condition": {
        "operator": "price_lte",
        "threshold": 8.8
      },
      "reason": "进入初步买入观察区，需要复核阿里片区、香客接待和经营现金流持续性",
      "trigger_id": "legacy-price-1",
      "type": "price"
    },
    {
      "active": true,
      "condition": {
        "operator": "price_lte",
        "threshold": 7.0
      },
      "reason": "进入更有安全边际的区间，若基本面未恶化可重新评估加仓",
      "trigger_id": "legacy-price-2",
      "type": "price"
    },
    {
      "active": true,
      "condition": {
        "operator": "price_gte",
        "threshold": 12.0
      },
      "reason": "超出基准公平价值上沿，若业绩没有兑现应降低预期收益率",
      "trigger_id": "legacy-price-3",
      "type": "price"
    },
    {
      "active": true,
      "condition": {
        "operator": "price_gte",
        "threshold": 16.0
      },
      "reason": "接近乐观情景估值，需警惕主题估值过热",
      "trigger_id": "legacy-price-4",
      "type": "price"
    }
  ],
  "underwriting": {
    "confidence": null,
    "evidence_valid_until": null,
    "reason_codes": [
      "legacy_reports_require_structured_rebaseline"
    ],
    "review_id": null,
    "status": null
  },
  "updated_at": "2026-07-21T21:15:00+08:00",
  "valuation": {
    "bear_value": null,
    "buy_zone": null,
    "currency": null,
    "fair_value_range": null,
    "price_as_of": null,
    "reduce_zone": null
  }
}
