{
  "identity": {
    "currency": "CNY",
    "market": "CN",
    "name": "广汽集团",
    "security_status": "active",
    "symbol": "CN:601238",
    "ticker": "601238"
  },
  "reports": {
    "historical_artifacts": [
      {
        "format": "legacy_v1",
        "path": "reports/2026-07-10-initial.md",
        "sha256": "780ebfb4c00bbf8c05cd7fa226e7d3fb6108fc9c55d501f37719713cd34fd9ed"
      }
    ],
    "history": [],
    "latest": null,
    "latest_by_type": {}
  },
  "research": {
    "coverage_status": "requires_rebaseline",
    "information_cutoff": null,
    "rebaseline_required": true
  },
  "schema_version": 2,
  "triggers": [
    {
      "active": true,
      "condition": {
        "date": "2026-08-31"
      },
      "reason": "复核2026年中报的毛利率、现金流、权益法收益和资产减值",
      "trigger_id": "legacy-review-1",
      "type": "date"
    },
    {
      "active": true,
      "condition": {
        "date": "2026-10-31"
      },
      "reason": "复核2026年三季报和三季度销量，判断反转是否延续",
      "trigger_id": "legacy-review-2",
      "type": "date"
    },
    {
      "active": true,
      "condition": {
        "operator": "price_lte",
        "threshold": 4.9
      },
      "reason": "进入买入区间上沿，检查中报和月度销量后可考虑首笔观察仓",
      "trigger_id": "legacy-price-1",
      "type": "price"
    },
    {
      "active": true,
      "condition": {
        "operator": "price_lte",
        "threshold": 4.2
      },
      "reason": "跌破逻辑止损参考位，需要复核是否存在更深资产减值或持续亏损风险",
      "trigger_id": "legacy-price-2",
      "type": "price"
    },
    {
      "active": true,
      "condition": {
        "operator": "price_gte",
        "threshold": 7.6
      },
      "reason": "进入减持区间下沿，若经营改善未同步兑现应降低仓位",
      "trigger_id": "legacy-price-3",
      "type": "price"
    }
  ],
  "underwriting": {
    "confidence": null,
    "evidence_valid_until": null,
    "reason_codes": [
      "legacy_reports_require_structured_rebaseline"
    ],
    "review_id": null,
    "status": null
  },
  "updated_at": "2026-07-21T21:15:00+08:00",
  "valuation": {
    "bear_value": null,
    "buy_zone": null,
    "currency": null,
    "fair_value_range": null,
    "price_as_of": null,
    "reduce_zone": null
  }
}
