{
  "identity": {
    "currency": "CNY",
    "market": "CN",
    "name": "顺控发展",
    "security_status": "active",
    "symbol": "CN:003039",
    "ticker": "003039"
  },
  "reports": {
    "historical_artifacts": [
      {
        "format": "legacy_v1",
        "path": "reports/2026-07-13-initial.md",
        "sha256": "6d7d0762e159e52311b96de6574cb04f4958ce966f4ad59c766674aba4b6ba65"
      }
    ],
    "history": [],
    "latest": null,
    "latest_by_type": {}
  },
  "research": {
    "coverage_status": "requires_rebaseline",
    "information_cutoff": null,
    "rebaseline_required": true
  },
  "schema_version": 2,
  "triggers": [
    {
      "active": true,
      "condition": {
        "date": "2026-08-31"
      },
      "reason": "发布2026年半年报或年报后复核收入、利润、经营现金流和分红能力",
      "trigger_id": "legacy-review-1",
      "type": "date"
    },
    {
      "active": true,
      "condition": {
        "date": "2026-12-31"
      },
      "reason": "水价、污水处理费、垃圾处理费政策出现调整时重估盈利中枢",
      "trigger_id": "legacy-review-2",
      "type": "date"
    },
    {
      "active": true,
      "condition": {
        "date": "2026-12-31"
      },
      "reason": "固废处置业务毛利率继续为负或亏损扩大时下调质量评级",
      "trigger_id": "legacy-review-3",
      "type": "date"
    },
    {
      "active": true,
      "condition": {
        "date": "2026-12-31"
      },
      "reason": "出现重大外延并购、低回报资本开支或关联交易时重新评估资本配置",
      "trigger_id": "legacy-review-4",
      "type": "date"
    },
    {
      "active": true,
      "condition": {
        "date": "2026-12-31"
      },
      "reason": "经营现金流净额连续两个报告期低于归母净利润时复核现金流质量",
      "trigger_id": "legacy-review-5",
      "type": "date"
    },
    {
      "active": true,
      "condition": {
        "operator": "price_lte",
        "threshold": 8.5
      },
      "reason": "进入可买区，复核最新财报和现金流后分批建仓",
      "trigger_id": "legacy-price-1",
      "type": "price"
    },
    {
      "active": true,
      "condition": {
        "operator": "price_lte",
        "threshold": 7.5
      },
      "reason": "进入强安全边际区，若基本面未变差可提高仓位",
      "trigger_id": "legacy-price-2",
      "type": "price"
    },
    {
      "active": true,
      "condition": {
        "operator": "price_gte",
        "threshold": 12.0
      },
      "reason": "估值偏贵，已有仓位考虑减仓",
      "trigger_id": "legacy-price-3",
      "type": "price"
    }
  ],
  "underwriting": {
    "confidence": null,
    "evidence_valid_until": null,
    "reason_codes": [
      "legacy_reports_require_structured_rebaseline"
    ],
    "review_id": null,
    "status": null
  },
  "updated_at": "2026-07-21T21:15:00+08:00",
  "valuation": {
    "bear_value": null,
    "buy_zone": null,
    "currency": null,
    "fair_value_range": null,
    "price_as_of": null,
    "reduce_zone": null
  }
}
