{
  "identity": {
    "currency": "CNY",
    "market": "CN",
    "name": "通宇通讯",
    "security_status": "active",
    "symbol": "CN:002792",
    "ticker": "002792"
  },
  "reports": {
    "historical_artifacts": [
      {
        "format": "legacy_v1",
        "path": "reports/2026-07-13-initial.md",
        "sha256": "22b867b50892f639690fb9767cc333ce1e890e80b496fe399b27408b5bae518f"
      }
    ],
    "history": [],
    "latest": null,
    "latest_by_type": {}
  },
  "research": {
    "coverage_status": "requires_rebaseline",
    "information_cutoff": null,
    "rebaseline_required": true
  },
  "schema_version": 2,
  "triggers": [
    {
      "active": true,
      "condition": {
        "date": "2026-08-31"
      },
      "reason": "半年报是验证扣非利润、经营现金流和卫星通信收入兑现的第一个关键节点",
      "trigger_id": "legacy-review-1",
      "type": "date"
    },
    {
      "active": true,
      "condition": {
        "date": "2026-10-31"
      },
      "reason": "三季报和潜在订单公告能验证卫星通信与5G-A主题是否形成实际收入",
      "trigger_id": "legacy-review-2",
      "type": "date"
    },
    {
      "active": true,
      "condition": {
        "date": "2026-08-31"
      },
      "reason": "募集资金用途变更会影响资本配置质量和资金使用效率",
      "trigger_id": "legacy-review-3",
      "type": "date"
    },
    {
      "active": true,
      "condition": {
        "date": "2026-10-31"
      },
      "reason": "毛利率和经营现金流是判断公司是否摆脱低质量增长的核心指标",
      "trigger_id": "legacy-review-4",
      "type": "date"
    },
    {
      "active": true,
      "condition": {
        "date": "2026-10-31"
      },
      "reason": "海外收入和大客户波动会直接影响传统通信业务稳定性",
      "trigger_id": "legacy-review-5",
      "type": "date"
    },
    {
      "active": true,
      "condition": {
        "operator": "price_lte",
        "threshold": 18.0
      },
      "reason": "进入基准合理价值区间上沿，赔率开始改善但仍需业绩验证",
      "trigger_id": "legacy-price-1",
      "type": "price"
    },
    {
      "active": true,
      "condition": {
        "operator": "price_lte",
        "threshold": 15.0
      },
      "reason": "低于可买区上沿，开始具备基本面安全边际",
      "trigger_id": "legacy-price-2",
      "type": "price"
    },
    {
      "active": true,
      "condition": {
        "operator": "price_gte",
        "threshold": 28.0
      },
      "reason": "明显高于基准合理价值，主题溢价偏高",
      "trigger_id": "legacy-price-3",
      "type": "price"
    },
    {
      "active": true,
      "condition": {
        "operator": "price_gte",
        "threshold": 32.0
      },
      "reason": "接近当前高估区，市值已大幅透支远期利润跃迁",
      "trigger_id": "legacy-price-4",
      "type": "price"
    }
  ],
  "underwriting": {
    "confidence": null,
    "evidence_valid_until": null,
    "reason_codes": [
      "legacy_reports_require_structured_rebaseline"
    ],
    "review_id": null,
    "status": null
  },
  "updated_at": "2026-07-21T21:15:00+08:00",
  "valuation": {
    "bear_value": null,
    "buy_zone": null,
    "currency": null,
    "fair_value_range": null,
    "price_as_of": null,
    "reduce_zone": null
  }
}
