{
  "identity": {
    "currency": "CNY",
    "market": "CN",
    "name": "江苏国泰",
    "security_status": "active",
    "symbol": "CN:002091",
    "ticker": "002091"
  },
  "reports": {
    "historical_artifacts": [
      {
        "format": "legacy_v1",
        "path": "reports/2026-07-12-initial.md",
        "sha256": "fe2e953052d2340683173a73a455c629c545fcbfa1b30046122b094e41763597"
      }
    ],
    "history": [],
    "latest": null,
    "latest_by_type": {}
  },
  "research": {
    "coverage_status": "requires_rebaseline",
    "information_cutoff": null,
    "rebaseline_required": true
  },
  "schema_version": 2,
  "triggers": [
    {
      "active": true,
      "condition": {
        "date": "2026-08-31"
      },
      "reason": "复核2026年半年报，重点验证扣非利润、经营现金流、应收账款、存货和汇兑损失",
      "trigger_id": "legacy-review-1",
      "type": "date"
    },
    {
      "active": true,
      "condition": {
        "date": "2026-10-31"
      },
      "reason": "复核2026年三季报，判断全年利润质量和分红可持续性",
      "trigger_id": "legacy-review-2",
      "type": "date"
    },
    {
      "active": true,
      "condition": {
        "operator": "price_lte",
        "threshold": 7.1
      },
      "reason": "进入买入观察区间，可复核汇率、应收和半年报预期后执行首笔仓位",
      "trigger_id": "legacy-price-1",
      "type": "price"
    },
    {
      "active": true,
      "condition": {
        "operator": "price_lte",
        "threshold": 6.3
      },
      "reason": "进入更有安全垫区间，但必须排除贸易摩擦、汇兑损失或资产减值导致的基本面下修",
      "trigger_id": "legacy-price-2",
      "type": "price"
    },
    {
      "active": true,
      "condition": {
        "operator": "price_gte",
        "threshold": 10.0
      },
      "reason": "进入减仓观察区间，若扣非利润和瑞泰新材景气未同步改善，应降低仓位",
      "trigger_id": "legacy-price-3",
      "type": "price"
    }
  ],
  "underwriting": {
    "confidence": null,
    "evidence_valid_until": null,
    "reason_codes": [
      "legacy_reports_require_structured_rebaseline"
    ],
    "review_id": null,
    "status": null
  },
  "updated_at": "2026-07-21T21:15:00+08:00",
  "valuation": {
    "bear_value": null,
    "buy_zone": null,
    "currency": null,
    "fair_value_range": null,
    "price_as_of": null,
    "reduce_zone": null
  }
}
